{"schemaVersion":"1.0.0","projectName":"Similar Email Owners","repository":"ExampleOrg/project","description":"Valid manifest with legitimate email local parts containing placeholder substrings.","projectType":"governance","technologies":["governance"],"governanceVersion":"1.1.0","riskClassification":"High","dataClassification":"Internal","owners":["todoist@example.invalid","placeholder-tools@example.invalid"],"environments":[{"name":"local","type":"development","production":false}],"applicableStandards":["agents/AGENTS_Base.md"],"requiredWorkflows":[],"externalIntegrations":[],"secretsProvider":"none-required-for-example","productionApprovalRequired":true,"evidence":{"completionEvidencePath":"evidence/completion.json","testEvidencePath":"evidence/tests.json"},"exceptions":[]}
