{"schemaVersion":"1.0.0","projectName":"Similar User Owner","repository":"ContosoOrg/project","description":"Valid manifest with a legitimate user name that merely contains a placeholder substring.","projectType":"governance","technologies":["governance"],"governanceVersion":"1.1.0","riskClassification":"High","dataClassification":"Internal","owners":["@todoist"],"environments":[{"name":"local","type":"development","production":false}],"applicableStandards":["agents/AGENTS_Base.md"],"requiredWorkflows":[],"externalIntegrations":[],"secretsProvider":"none-required-for-example","productionApprovalRequired":true,"evidence":{"completionEvidencePath":"evidence/completion.json","testEvidencePath":"evidence/tests.json"},"exceptions":[]}
